<?xml version="1.0" encoding="UTF-8"?>
<GLSK_MarketDocument xsi:schemaLocation="urn:iec62325.351:tc57wg16:451-n:glskdocument:2:1 iec62325-451-n-glsk_v2_1.xsd" xmlns="urn:iec62325.351:tc57wg16:451-n:glskdocument:2:1" xmlns:xsi="http://www.w3.org/2001/XMLSchema-instance">
	<mRID>10XES-REE------E-20170412-SWECCD2</mRID>
	<revisionNumber>1</revisionNumber>
	<type>B22</type>
	<process.processType>A48</process.processType>
	<sender_MarketParticipant.mRID codingScheme="A01">10XES-REE------E</sender_MarketParticipant.mRID>
	<sender_MarketParticipant.marketRole.type>A04</sender_MarketParticipant.marketRole.type>
	<receiver_MarketParticipant.mRID codingScheme="A01">22XCORESO------S</receiver_MarketParticipant.mRID>
	<receiver_MarketParticipant.marketRole.type>A36</receiver_MarketParticipant.marketRole.type>
	<createdDateTime>2017-07-18T06:31:36Z</createdDateTime>
	<time_Period.timeInterval>
		<start>2017-04-12T02:00Z</start>
		<end>2027-04-12T03:00Z</end>
	</time_Period.timeInterval> 
	<domain.mRID codingScheme="A01">10YCB-FR-ES-PT-S</domain.mRID>
	<TimeSeries>
		<mRID>B45TestBE</mRID>
		<subject_Domain.mRID codingScheme="A01">10YBE----------2</subject_Domain.mRID>
		<curveType>A01</curveType>
		<Period>
			<timeInterval>
				<start>2021-04-02T05:00Z</start>
				<end>2021-04-02T06:00Z</end>
			</timeInterval>
			<resolution>PT60M</resolution>
			<Point>
				<position>1</position>
				<SKBlock_TimeSeries>
					<businessType>B45</businessType>
					<mktPSRType.psrType>A01</mktPSRType.psrType>
					<flowDirection.direction>A01</flowDirection.direction>
					<measurement_Unit.name>MAW</measurement_Unit.name>
					<attributeInstanceComponent.position>2</attributeInstanceComponent.position>
					<RegisteredResource>
						<mRID codingScheme="A02">550ebe0d-f2b2-48c1-991f-cebea43a21aa</mRID>
						<name>FFR2AA1 _generator</name>
						<resourceCapacity.maximumCapacity>2002</resourceCapacity.maximumCapacity>
						<resourceCapacity.minimumCapacity>-402</resourceCapacity.minimumCapacity>
					</RegisteredResource>
				</SKBlock_TimeSeries>
			</Point>
		</Period>
	</TimeSeries>
	<TimeSeries> 
		<mRID>B45TestNL</mRID>
		<subject_Domain.mRID codingScheme="A01">10YNL----------L</subject_Domain.mRID>
		<curveType>A01</curveType> 
		<Period>
			<timeInterval>
				<start>2021-04-02T05:00Z</start>
				<end>2021-04-02T06:00Z</end>
			</timeInterval>
			<resolution>PT60M</resolution>
			<Point>
				<position>1</position>
				<SKBlock_TimeSeries>
					<businessType>B45</businessType>
					<mktPSRType.psrType>A01</mktPSRType.psrType>
					<flowDirection.direction>A01</flowDirection.direction>
					<measurement_Unit.name>MAW</measurement_Unit.name>
					<attributeInstanceComponent.position>1</attributeInstanceComponent.position>
					<RegisteredResource>
						<mRID codingScheme="A02">9c3b8f97-7972-477d-9dc8-87365cc0ad0e</mRID>
						<name>FFR1AA1 _generator</name>
						<resourceCapacity.maximumCapacity>2001</resourceCapacity.maximumCapacity>
						<resourceCapacity.minimumCapacity>-401</resourceCapacity.minimumCapacity>
					</RegisteredResource>
				</SKBlock_TimeSeries>
			</Point>
		</Period>
	</TimeSeries>
</GLSK_MarketDocument>
